### ISSUE TITLE
Why is my put data callback wrong ? :'(

### ISSUE THREAD

**Issue by dohnuts** [chansen/p5-http-tiny#92]
When i use a callback to push chunks i always got

'Timed out while waiting for socket to become ready for reading'
'status' => 599,

Not sure what i did wrong here

(version is 0.043);

```
use HTTP::Tiny;
use Data::Dumper;

my $h = HTTP::Tiny->new( timeout => 2 );

my $l = "http://mywebdavthatworkswithput/boooo.txt";

sub reader {
  my $a = int rand 10;
  if ($a < 5) { return undef; }
  return "dATADATATDATATADATAT";
}

my $r = $h->put($l, { content => \&reader });

print Dumper($r);

```

put $l, { content => "foo" } works *

**Comment by xdg** [comment]
Using a callback sends data with chunked transfer encoding.  Are you sure the server knows how to deal with that correctly?

**Comment by dohnuts** [comment]
server is nginx with webdav.

**Comment by xdg** [comment]
See this post: http://serverfault.com/questions/624897/getting-a-chunked-request-through-nginx

Does it work if you use a longer timeout?

**Comment by dohnuts** [comment]
Hello,

http://nginx.org/en/docs/http/ngx_http_dav_module.html does not have any timeout, and i dont use proxy path.

http://nginx.org/en/docs/http/ngx_http_core_module.html#client_body_timeout nginx default timeout are big enough.

The server does not send an error.


this is the tcpdump of the transfert:
```
1470503305.686345 fe:e1:ba:d6:38:45 fe:e1:ba:d0:36:d6 0800 78: 10.32.0.18.2505 > 10.32.0.254.80: SWE 559228675:559228675(0) win 16384 <mss 1336,nop,nop,sackOK,nop,wscale 3,nop,nop,timestamp 2254950727 0> (DF)
  0000: fee1 bad0 36d6 fee1 bad6 3845 0800 4500  ....6.....8E..E.
  0010: 0040 e306 4000 4006 4262 0a20 0012 0a20  .@..@.@.Bb. ...
  0020: 00fe 09c9 0050 2155 2703 0000 0000 b0c2  .....P!U'.......
  0030: 4000 364a 0000 0204 0538 0101 0402 0103  @.6J.....8......
  0040: 0303 0101 080a 8667 d147 0000 0000       .......g.G....

1470503305.688520 fe:e1:ba:d6:38:45 fe:e1:ba:d0:36:d6 0800 66: 10.32.0.18.2505 > 10.32.0.254.80: . ack 3494454212 win 2048 <nop,nop,timestamp 2254950727 1944959753> (DF)
  0000: fee1 bad0 36d6 fee1 bad6 3845 0800 4500  ....6.....8E..E.
  0010: 0034 ea6b 4000 4006 3b09 0a20 0012 0a20  .4.k@.@.;.. ...
  0020: 00fe 09c9 0050 2155 2704 d049 23c4 8010  .....P!U'..I#...
  0030: 0800 8c47 0000 0101 080a 8667 d147 73ed  ...G.......g.Gs.
  0040: bb09                                     ..

1470503305.688770 fe:e1:ba:d6:38:45 fe:e1:ba:d0:36:d6 0800 223: 10.32.0.18.2505 > 10.32.0.254.80: P 0:157(157) ack 1 win 2048 <nop,nop,timestamp 2254950727 1944959753> (DF)
  0000: fee1 bad0 36d6 fee1 bad6 3845 0800 4500  ....6.....8E..E.
  0010: 00d1 4e0c 4000 4006 d6cb 0a20 0012 0a20  ..N.@.@.... ...
  0020: 00fe 09c9 0050 2155 2704 d049 23c4 8018  .....P!U'..I#...
  0030: 0800 1c88 0000 0101 080a 8667 d147 73ed  ...........g.Gs.
  0040: bb09 5055 5420 2f63 6c6f 7564 6761 7465  ..PUT /cloudgate
  0050: 2f74 6865 7262 656c 652f 626f 6f6f 6f2e  /therbele/boooo.
  0060: 7478 7420 4854 5450 2f31 2e31 0d0a 486f  txt HTTP/1.1..Ho
  0070: 7374 3a20 726f 7574 6572 0d0a 5573 6572  st: router..User
  0080: 2d41 6765 6e74 3a20 4854 5450 2d54 696e  -Agent: HTTP-Tin
  0090: 792f 302e 3034 330d 0a54 7261 6e73 6665  y/0.043..Transfe
  00a0: 722d 456e 636f 6469 6e67 3a20 6368 756e  r-Encoding: chun
  00b0: 6b65 640d 0a43 6f6e 7465 6e74 2d54 7970  ked..Content-Typ
  00c0: 653a 2061 7070 6c69 6361 7469 6f6e 2f6f  e: application/o
  00d0: 6374 6574 2d73 7472 6561 6d0d 0a0d 0a    ctet-stream....

1470503305.887605 fe:e1:ba:d6:38:45 fe:e1:ba:d0:36:d6 0800 95: 10.32.0.18.2505 > 10.32.0.254.80: P 157:186(29) ack 1 win 2048 <nop,nop,timestamp 2254950728 1944959753> (DF)
  0000: fee1 bad0 36d6 fee1 bad6 3845 0800 4500  ....6.....8E..E.
  0010: 0051 a9a8 4000 4006 7baf 0a20 0012 0a20  .Q..@.@.{.. ...
  0020: 00fe 09c9 0050 2155 27a1 d049 23c4 8018  .....P!U'..I#...
  0030: 0800 1a50 0000 0101 080a 8667 d148 73ed  ...P.......g.Hs.
  0040: bb09 3134 0d0a 6441 5441 4441 5441 5444  ..14..dATADATATD
  0050: 4154 4154 4144 4154 4154 0d0a 300d 0a    ATATADATAT..0..

1470503307.699691 fe:e1:ba:d6:38:45 fe:e1:ba:d0:36:d6 0800 66: 10.32.0.18.2505 > 10.32.0.254.80: F 186:186(0) ack 1 win 2048 <nop,nop,timestamp 2254950731 1944959754> (DF)
  0000: fee1 bad0 36d6 fee1 bad6 3845 0800 4500  ....6.....8E..E.
  0010: 0034 1d25 4000 4006 0850 0a20 0012 0a20  .4.%@.@..P. ...
  0020: 00fe 09c9 0050 2155 27be d049 23c4 8011  .....P!U'..I#...
  0030: 0800 8b87 0000 0101 080a 8667 d14b 73ed  ...........g.Ks.
  0040: bb0a                                     ..

1470503307.710252 fe:e1:ba:d6:38:45 fe:e1:ba:d0:36:d6 0800 66: 10.32.0.18.2505 > 10.32.0.254.80: . ack 2 win 2048 <nop,nop,timestamp 2254950731 1944959757> (DF)
  0000: fee1 bad0 36d6 fee1 bad6 3845 0800 4500  ....6.....8E..E.
  0010: 0034 ed93 4000 4006 37e1 0a20 0012 0a20  .4..@.@.7.. ...
  0020: 00fe 09c9 0050 2155 27bf d049 23c5 8010  .....P!U'..I#...
  0030: 0800 8b83 0000 0101 080a 8667 d14b 73ed  ...........g.Ks.
  0040: bb0d 
```


the full perl result

```
$VAR1 = {
          'content' => 'Timed out while waiting for socket to become ready for reading
',
          'success' => '',
          'reason' => 'Internal Exception',
          'status' => 599,
          'url' => 'http://mywebdavthatworkswithput/boooo.txt',
          'headers' => {
                         'content-length' => 63,
                         'content-type' => 'text/plain'
                       }
        };
````

Feels like HTTP::Tiny is waiting for some kind of ACK that he never received. Can we get someone from nginx have a look at this ?


Notes: 
 As TCP wont send large packet, would it be possible to have a data cb that just read when the read socket is ready , and without chunk transfer ?

**Comment by dohnuts** [comment]
After analysis i tried this :

**Comment by dohnuts** [comment]
Tried to add trailing \r\n without success

```
--- /usr/libdata/perl5/HTTP/Tiny.pm.base        Sun Aug  7 08:56:46 2016
+++ /usr/libdata/perl5/HTTP/Tiny.pm     Sun Aug  7 08:57:12 2016
@@ -1254,7 +1254,7 @@
         my $chunk  = sprintf '%X', length $data;
            $chunk .= "\x0D\x0A";
            $chunk .= $data;
-           $chunk .= "\x0D\x0A";
+           $chunk .= "\x0D\x0A\x0D\x0A";

         $self->write($chunk);
     }
````

````
$VAR1 = {
          'headers' => {
                         'content-type' => 'text/plain',
                         'content-length' => 63
                       },
          'url' => 'http://mywebdavthatworkswithput/boooo.txt',
          'status' => 599,
          'success' => '',
          'reason' => 'Internal Exception',
          'content' => 'Timed out while waiting for socket to become ready for reading
'
        };
````

**Comment by dohnuts** [comment]
it s normal right ?

```
$ git status
On branch issue-92
Changes to be committed:
  (use "git reset HEAD <file>..." to unstage)

        modified:   lib/HTTP/Tiny.pm


$ git commit
[issue-92 81a3fba] http://tools.ietf.org/html/rfc2616#section-3.6.1:
 1 file changed, 1 insertion(+), 1 deletion(-)
$ git push --set-upstream issue-92 issue-92
Username for 'https://github.com':
Password for 'https://dohnuts@github.com':
remote: Permission to chansen/p5-http-tiny.git denied to dohnuts.
```
